{
  "$schema": "https://json-schema.org/draft/2020-12/schema",
  "$id": "https://github.com/LeandroVarga/banco-carrefour/schemas/release-manifest.schema.json",
  "title": "Banco Carrefour - Manifesto de Release (Amazon ECR, alvo AWS definitivo)",
  "description": "Identidade imutável de uma release real (build once, publicação no Amazon ECR via OIDC, gerada por scripts/ci/generate-release-manifest.sh e atualizada por scripts/ci/publish-validated-images.sh), ver ADR-0013. Separa 'components' (os 4 workloads de negócio) de 'operationalArtifacts' (o migration-runner), nunca tratando o artefato operacional como um 5º workload de negócio. Esta é a única referência formal do manifesto de release.",
  "type": "object",
  "additionalProperties": false,
  "required": [
    "schemaVersion",
    "releaseId",
    "sourceRepository",
    "sourceCommit",
    "sourceRef",
    "workflow",
    "createdAt",
    "registryType",
    "awsAccountId",
    "awsRegion",
    "buildPlatform",
    "components",
    "operationalArtifacts",
    "overallPublicationStatus",
    "overallVerdict"
  ],
  "properties": {
    "schemaVersion": {
      "type": "string",
      "const": "4.0.0",
      "description": "Versão deste schema. 4.0.0 separa 'components' (exatamente os 4 workloads de negócio) de 'operationalArtifacts' (artefatos operacionais como migration-runner, nunca um 5º workload de negócio)."
    },
    "releaseId": {
      "type": "string",
      "pattern": "^sha-[0-9a-f]{40}$",
      "description": "Identificador único da release - sempre 'sha-<commit completo>', nunca um valor curto ou mutável."
    },
    "sourceRepository": {
      "type": ["string", "null"],
      "pattern": "^[A-Za-z0-9_.-]+/[A-Za-z0-9_.-]+$",
      "description": "owner/repo do GitHub de origem (GITHUB_REPOSITORY) - null fora de uma execução hospedada."
    },
    "sourceCommit": {
      "type": "string",
      "pattern": "^[0-9a-f]{40}$",
      "description": "SHA completa de 40 hex - nunca abreviada. Compartilhada por releaseId e por cada componente."
    },
    "sourceRef": {
      "type": ["string", "null"],
      "minLength": 1,
      "description": "Ref do Git que originou a release (ex.: refs/heads/main) - null fora de uma execução hospedada."
    },
    "workflow": {
      "type": "object",
      "additionalProperties": false,
      "required": ["name", "runId", "runUrl"],
      "properties": {
        "name": { "type": "string", "minLength": 1 },
        "runId": { "type": ["string", "null"] },
        "runUrl": { "type": ["string", "null"], "pattern": "^https://" }
      }
    },
    "createdAt": {
      "type": "string",
      "pattern": "^[0-9]{4}-[0-9]{2}-[0-9]{2}T[0-9]{2}:[0-9]{2}:[0-9]{2}Z$",
      "description": "Timestamp UTC (ISO 8601, sufixo Z) de geração do manifesto."
    },
    "registryType": {
      "type": "string",
      "const": "ecr",
      "description": "Registry oficial desta release - sempre Amazon ECR. Nenhum outro registry é uma origem válida de release oficial neste repositório."
    },
    "awsAccountId": {
      "type": ["string", "null"],
      "pattern": "^[0-9]{12}$",
      "description": "Conta AWS proprietária do registry ECR, derivada de ECR_REGISTRY (nunca inventada) - null quando ECR_REGISTRY ainda não está configurado nesta sessão."
    },
    "awsRegion": {
      "type": ["string", "null"],
      "pattern": "^[a-z]{2}-[a-z]+-[0-9]$",
      "description": "Região AWS do registry ECR, derivada de ECR_REGISTRY (nunca inventada) - null quando ECR_REGISTRY ainda não está configurado."
    },
    "buildPlatform": {
      "type": "string",
      "minLength": 1,
      "description": "Plataforma de build das imagens (ex.: linux/amd64)."
    },
    "components": {
      "type": "array",
      "minItems": 4,
      "maxItems": 4,
      "items": { "$ref": "#/$defs/component" },
      "description": "Exatamente os 4 workloads de negócio deployáveis (ledger-api, ledger-outbox-publisher, consolidation-api, consolidation-worker) - nunca um artefato operacional (ver 'operationalArtifacts'). Cada 'component' desta coleção é restrito pelo enum a um desses 4 nomes."
    },
    "operationalArtifacts": {
      "type": "array",
      "minItems": 1,
      "items": { "$ref": "#/$defs/operationalArtifact" },
      "description": "Artefatos operacionais de release (hoje: apenas migration-runner) - publicados pela MESMA cadeia build-once/SBOM/scan/atestação dos 4 workloads de negócio, mas NUNCA um 5º workload de negócio no modelo de domínio arquitetural (nunca um ECS Service, nunca uma unidade de negócio nos diagramas C4). Um artefato operacional nunca pode aparecer em 'components', e um dos 4 workloads de negócio nunca pode aparecer aqui."
    },
    "overallPublicationStatus": {
      "type": "string",
      "enum": ["pending", "partial", "published", "failed"],
      "description": "Agregado real dos publicationStatus dos 4 componentes DE NEGÓCIO E de todos os operationalArtifacts (5 entradas no total hoje) - nunca 'published' quando só parte publicou."
    },
    "overallVerdict": {
      "type": "string",
      "enum": ["pending", "passed", "failed"],
      "description": "'passed' só quando overallPublicationStatus=published e nenhuma atestação (de components OU operationalArtifacts) está em 'failed'. 'failed' quando qualquer componente ou artefato operacional está em conflict/failed ou qualquer atestação falhou. 'pending' enquanto a publicação real ainda não foi concluída."
    }
  },
  "$defs": {
    "component": {
      "type": "object",
      "additionalProperties": false,
      "required": [
        "component",
        "sourceCommit",
        "sourceTreeClean",
        "localImageId",
        "layerDigests",
        "ociRevision",
        "canonicalTag",
        "ecrRepositoryUri",
        "remoteEcrDigest",
        "sbomPath",
        "vulnerabilityReportPath",
        "vulnerabilityVerdict",
        "activeExceptionsApplied",
        "publicationStatus",
        "provenanceAttestation",
        "sbomAttestation"
      ],
      "properties": {
        "component": {
          "type": "string",
          "enum": ["ledger-api", "ledger-outbox-publisher", "consolidation-api", "consolidation-worker"]
        },
        "sourceCommit": {
          "type": "string",
          "pattern": "^[0-9a-f]{40}$"
        },
        "sourceTreeClean": { "type": "boolean" },
        "localImageId": {
          "type": "string",
          "minLength": 1,
          "description": "Id da imagem local (image store) usada para provar build-once - nunca comparado diretamente ao digest remoto do registry."
        },
        "layerDigests": {
          "type": "array",
          "items": { "type": "string" },
          "minItems": 1,
          "description": "RootFS.Layers - identidade de conteúdo portável entre registries, usada para decidir idempotência/conflito de publicação."
        },
        "ociRevision": {
          "type": "string",
          "pattern": "^[0-9a-f]{40}$",
          "description": "Label org.opencontainers.image.revision lida diretamente da imagem local - deve ser igual a sourceCommit, verificado pelo gerador antes de gravar o manifesto."
        },
        "canonicalTag": {
          "type": "string",
          "pattern": "^sha-[0-9a-f]{40}$",
          "description": "Tag imutável 'sha-<commit completo>' - nunca 'latest' nem outro valor mutável."
        },
        "ecrRepositoryUri": {
          "type": ["string", "null"],
          "pattern": "^[0-9]{12}\\.dkr\\.ecr\\.[a-z0-9-]+\\.amazonaws\\.com/banco-carrefour/(ledger-api|ledger-outbox-publisher|consolidation-api|consolidation-worker)$",
          "description": "Repositório ECR totalmente qualificado - null antes de ECR_REGISTRY estar configurado."
        },
        "remoteEcrDigest": {
          "type": ["string", "null"],
          "pattern": "^sha256:[0-9a-f]{64}$",
          "description": "Digest real retornado pelo Amazon ECR (docker push + aws ecr describe-images, cruzados) - null enquanto publicationStatus=pending."
        },
        "sbomPath": { "type": "string", "minLength": 1 },
        "vulnerabilityReportPath": { "type": "string", "minLength": 1 },
        "vulnerabilityVerdict": {
          "type": "string",
          "enum": ["pass", "pass_with_exceptions", "fail", "scan_error"]
        },
        "activeExceptionsApplied": {
          "type": "array",
          "items": { "type": "string" }
        },
        "publicationStatus": {
          "type": "string",
          "enum": ["pending", "already_published", "published", "conflict", "failed"]
        },
        "provenanceAttestation": { "$ref": "#/$defs/attestation" },
        "sbomAttestation": { "$ref": "#/$defs/attestation" }
      }
    },
    "operationalArtifact": {
      "type": "object",
      "additionalProperties": false,
      "required": [
        "artifactType",
        "component",
        "runtimePurpose",
        "sourceCommit",
        "sourceTreeClean",
        "localImageId",
        "layerDigests",
        "ociRevision",
        "canonicalTag",
        "ecrRepositoryUri",
        "remoteEcrDigest",
        "digestQualifiedReference",
        "sbomPath",
        "sbomDigest",
        "vulnerabilityReportPath",
        "vulnerabilityVerdict",
        "activeExceptionsApplied",
        "publicationStatus",
        "provenanceAttestation",
        "sbomAttestation"
      ],
      "properties": {
        "artifactType": {
          "type": "string",
          "enum": ["migration-runner"],
          "description": "Classificação explícita do artefato operacional - nunca 'component'/workload de negócio. O único tipo conhecido hoje é 'migration-runner'; um novo tipo exigiria estender este enum explicitamente, nunca inferido."
        },
        "component": {
          "type": "string",
          "enum": ["migration-runner"],
          "description": "Nome do artefato - mesmo campo usado por 'component' (para reaproveitar as mesmas ferramentas), mas restrito por este enum a artefatos operacionais conhecidos, nunca a um dos 4 workloads de negócio."
        },
        "runtimePurpose": {
          "type": "string",
          "minLength": 1,
          "description": "Descrição explícita de por que este artefato existe e como é executado - nunca implícito. Para migration-runner: task ECS/Fargate one-off (nunca aws_ecs_service) que aplica migrations EF Core fase EXPAND via advisory lock PostgreSQL, selecionada em tempo de 'aws ecs run-task' (--boundary Ledger|Consolidation), nunca um serviço de longa duração."
        },
        "sourceCommit": {
          "type": "string",
          "pattern": "^[0-9a-f]{40}$",
          "description": "Deve ser idêntico ao sourceCommit de todos os components desta mesma release - o artefato operacional pertence à MESMA release, nunca a um commit diferente."
        },
        "sourceTreeClean": { "type": "boolean" },
        "localImageId": {
          "type": "string",
          "minLength": 1
        },
        "layerDigests": {
          "type": "array",
          "items": { "type": "string" },
          "minItems": 1
        },
        "ociRevision": {
          "type": "string",
          "pattern": "^[0-9a-f]{40}$"
        },
        "canonicalTag": {
          "type": "string",
          "pattern": "^sha-[0-9a-f]{40}$",
          "description": "Tag imutável 'sha-<commit completo>' - nunca 'latest' nem outro valor mutável (mesma regra dos 4 workloads de negócio)."
        },
        "ecrRepositoryUri": {
          "type": ["string", "null"],
          "pattern": "^[0-9]{12}\\.dkr\\.ecr\\.[a-z0-9-]+\\.amazonaws\\.com/banco-carrefour/migration-runner$",
          "description": "Repositório ECR operacional dedicado (banco-carrefour/migration-runner) - nunca compartilhado com um repositório de workload de negócio."
        },
        "remoteEcrDigest": {
          "type": ["string", "null"],
          "pattern": "^sha256:[0-9a-f]{64}$"
        },
        "digestQualifiedReference": {
          "type": ["string", "null"],
          "pattern": "^[0-9]{12}\\.dkr\\.ecr\\.[a-z0-9-]+\\.amazonaws\\.com/banco-carrefour/migration-runner@sha256:[0-9a-f]{64}$",
          "description": "Referência completa qualificada por digest ('<ecrRepositoryUri>@<remoteEcrDigest>'), pronta para uso direto no registro da task definition ECS (aws ecs register-task-definition) - nunca uma tag mutável, nunca null quando publicationStatus indica publicação concluída."
        },
        "sbomPath": { "type": "string", "minLength": 1 },
        "sbomDigest": {
          "type": "string",
          "pattern": "^sha256:[0-9a-f]{64}$",
          "description": "SHA-256 do conteúdo do arquivo SBOM referenciado por sbomPath - identidade adicional do próprio SBOM (evidência mais forte do que apenas o caminho do arquivo), exigida para artefatos operacionais."
        },
        "vulnerabilityReportPath": { "type": "string", "minLength": 1 },
        "vulnerabilityVerdict": {
          "type": "string",
          "enum": ["pass", "pass_with_exceptions", "fail", "scan_error"]
        },
        "activeExceptionsApplied": {
          "type": "array",
          "items": { "type": "string" }
        },
        "publicationStatus": {
          "type": "string",
          "enum": ["pending", "already_published", "published", "conflict", "failed"]
        },
        "provenanceAttestation": { "$ref": "#/$defs/attestation" },
        "sbomAttestation": { "$ref": "#/$defs/attestation" }
      }
    },
    "attestation": {
      "type": "object",
      "additionalProperties": false,
      "required": ["status", "reference"],
      "properties": {
        "status": {
          "type": "string",
          "enum": ["not_applicable", "pending_hosted_execution", "generated", "failed", "verified"],
          "description": "'generated'/'verified' só são válidos quando produzidos por uma execução hospedada real (actions/attest-build-provenance ou actions/attest com sbom-path) associada ao digest ECR real - nunca gerados localmente. 'failed' registra uma tentativa real sem sucesso (nunca omitida silenciosamente). 'verified' é reservado para quando 'gh attestation verify' já confirmou a atestação contra o artefato ECR real."
        },
        "reference": {
          "type": ["string", "null"],
          "description": "attestation-id ou attestation-url retornado pela action oficial do GitHub - obrigatório (não nulo, não placeholder) quando status é 'generated' ou 'verified'; deve ser null para 'not_applicable' e 'pending_hosted_execution'."
        }
      }
    }
  }
}
